{
  "schema": "agent-core.config/1",
  "host_label": "desk",
  "state_root": "<STATE>",
  "backup_root": "<HOST_DATA>/backups",
  "prompt_injection": {
    "lines": [
      "Read matched lessons before acting.",
      "Only Claude Code: for a user correction or evidence-verified method that warrants one reusable, costly lesson with an observable trigger and checkable sink, run \"<INSTALL_ROOT>/bin/agent-core\" lessons capture with all required fields to create at most one inbox candidate; otherwise skip; never write canonical lessons or promote automatically; other runtimes skip."
    ]
  },
  "targets": [
    {"id": "claude-code", "runtime": "claude-code", "root": "<RUNTIME_A>", "rules_target": "CLAUDE.md", "lessons_target": "LESSONS.md", "case_law_target": "CASE_LAW.md", "skills_root": "skills", "hook_target": "hooks/user_prompt.sh"},
    {"id": "codex", "runtime": "codex", "root": "<RUNTIME_B>", "rules_target": "AGENTS.md", "lessons_target": "LESSONS.md", "case_law_target": "CASE_LAW.md", "skills_root": "skills", "hook_target": "hooks/user_prompt.sh"}
  ],
  "capability_overrides": []
}
