{
  "schema": "agent-core.config/1",
  "host_label": "desk",
  "state_root": "<STATE>",
  "backup_root": "<HOST_DATA>/backups",
  "prompt_injection": {
    "lines": [
      "Read the matched lessons before acting.",
      "Record a bounded lesson candidate at completion when evidence warrants it."
    ]
  },
  "targets": [
    {"id": "claude-code", "runtime": "claude-code", "root": "<RUNTIME_A>", "rules_target": "CLAUDE.md", "lessons_target": "LESSONS.md", "case_law_target": "CASE_LAW.md", "skills_root": "skills", "hook_target": "hooks/user_prompt.sh"},
    {"id": "codex", "runtime": "codex", "root": "<RUNTIME_B>", "rules_target": "AGENTS.md", "lessons_target": "LESSONS.md", "case_law_target": "CASE_LAW.md", "skills_root": "skills", "hook_target": "hooks/user_prompt.sh"}
  ],
  "capability_overrides": []
}
